{"accounting_contract":{"artifact_id":"rcid:v1:applicability-rule-set:h:jcs-sha256-v1:858aab11a14e4fc919f0980b8621f0067d1d8ed2299b838f04caacaff8009b43","digest_sha256":"0eb713cd6c144f574c64df6bdcaba8c44d6a95e356ca54b87e960aa6d2fb7c2c","path":"ontology/denominator/regex-semantic-denominator-accounting-2026-09-10.v1.json"},"audit_report":{"artifact_id":"rcid:v1:finding-revision:h:jcs-sha256-v1:b1c5b8d0e3a474efb8b88c659345f7b48cab78c48ec8df78d109491f5959f6d8","digest_sha256":"51697c67356b0fb45214638107e86d549e2944aafb4d101c11d888964b9242d2","path":"reports/semantics/regex-semantic-denominator-audit-2026-09-10.v1.json"},"authority_scope":"Semantic-side denominator accounting only; exact profiles and the final logical-execution denominator remain deferred.","denominator_authority":{"artifact_id":"rcid:v1:artifact-set-manifest:h:jcs-sha256-v1:cf5764175091ef468b88ec296d23791027411f98dd0103829a6bcddd49571ebd","digest_sha256":"abbf4d883bd32729e26b4130d9768bdbf1bc9869b797ea10f4a11ae87fb3a75d","file_sha256":"b8e7081f5f4717c657915220c4dd5acbc69ca19e2f101823eeb3faba501fc4a8","path":"ontology/authority/current-semantic-denominator.v1.json"},"derivation_id":"rcid:v1:assertion-derivation:u7:01a08bfe-f086-7b3f-bc06-0ed1f691f052","derivation_revision_id":"rcid:v1:assertion-derivation-revision:h:jcs-sha256-v1:3df59ce23218dd7f5e3b38a81aa9c069a3c3a1842dee7bd6cd344fd6f5db8631","effective_on":"2026-09-10","governance":{"hosted_integrity_veto_required":true,"local_authoritative_certification_required":true,"scientific_certification_issued":false},"index_digest_sha256":"6640f0650be7930ad8e32b5e98aac70f2d10eefe789f6e6eb35dfaf344feabfe","index_id":"rcid:v1:artifact-set-manifest:h:jcs-sha256-v1:20aeff303ec0900dc791f724a65bd72eefcfd4f96b25d42d0a36d642b9841a0d","profile_expansion_handoff":{"artifact_id":"rcid:v1:ontology-projection:h:jcs-sha256-v1:6d50a66b9d60b37724f6de3a15e548309e2ff6aa2fb5daef82adbcf6d4f82265","digest_sha256":"181bcf8c60c9f22c3545ba9c0238fda9d82b83976715d4a21945be5e5c219743","path":"ontology/projections/regex-semantic-profile-expansion-handoff-2026-09-10.v1.json"},"schema_version":"semantic-denominator-audit-authority.v1"}
